### ISSUE TITLE
Under TLS connection, the data transmitted may experience out-of-order delivery in high concurrency situations.

### ISSUE THREAD

**Issue by YUPANZHAO** [pjsip/pjproject#4533]
### Describe the bug

We found that after registering to FreeSwitch using the TLS mode of pjsip, the TLS connection is actively disconnected by FreeSwitch during a large number of communication interactions. The logs indicate that this is due to decryption failure. 

Through packet capturing and decryption analysis, it was discovered that the data packets sent by pjsip failed to be decrypted by the peer due to an issue with the order being reversed.

The following is the information from the packet capture, which records the last data sent by pjsip before the disconnection. It is clear that only two out of the six Record Layers have been decrypted.

```
Frame 59780: 3446 bytes on wire (27568 bits), 3462 bytes captured (27696 bits)
Linux cooked capture v1
Internet Protocol Version 4, Src: 172.16.xx.xx, Dst: 172.16.xx.xx
Transmission Control Protocol, Src Port: 53681, Dst Port: 5061, Seq: 395471, Ack: 471008, Len: 3378
Transport Layer Security
    TLSv1.2 Record Layer: Application Data Protocol: Session Initiation Protocol
        Content Type: Application Data (23)
        Version: TLS 1.2 (0x0303)
        Length: 558
        Encrypted Application Data […]: 77a14839f7dddb42623d0ffaf34c5a305f799d8b0c58a0c7d8810aec26d5b5868bcb7125ba2673798d6f50f15927e766b1c0cd5310760c30090b0902b93e31673adf73c01ad7e7e6c08273489eec79db500c04e33fc5ee947d6c2647754b0b91d0464ee54a9ea
        [Application Data Protocol: Session Initiation Protocol]
    TLSv1.2 Record Layer: Application Data Protocol: Session Initiation Protocol
        Content Type: Application Data (23)
        Version: TLS 1.2 (0x0303)
        Length: 558
        Encrypted Application Data […]: 77a14839f7dddb444e75c475a1079dc96027b9f7b4eb92c48c12abd0ec0c46174ab692b43c27d2bcb9d413e4a3dff36d7cfa9854ea255719e6010537bc6bc62829d0466e25a2dabab3905375db536f3cfe5e09e310e62f92f51893ba88591efb09b46b6b0e3d9
        [Application Data Protocol: Session Initiation Protocol]
    TLSv1.2 Record Layer: Application Data Protocol: Session Initiation Protocol
        Content Type: Application Data (23)
        Version: TLS 1.2 (0x0303)
        Length: 558
        Encrypted Application Data […]: 77a14839f7dddb4307787f1f31d135829945d147b1bc80f3af0ed866a79a52c8391ea03ebc1d1690c192a33c07338b930f0a1a7fdd90f17a13c9ae67f9b5c30eea2472ec2bcbfb83ec63dbab93fca051070a4aab41904ea47138295817928266cef8db4b95d80
        [Application Data Protocol: Session Initiation Protocol]
    TLSv1.2 Record Layer: Application Data Protocol: Session Initiation Protocol
    TLSv1.2 Record Layer: Application Data Protocol: Session Initiation Protocol
    TLSv1.2 Record Layer: Application Data Protocol: Session Initiation Protocol
Session Initiation Protocol (INFO)
Session Initiation Protocol (INFO)
```

Fortunately, we are using the TLS 1.2 cipher suite: TLS_ECDHE_RSA_WITH_AES_256_GCM_SHA384, which allows us to confirm the specific order of the Record Layer by observing the first eight bytes of the encrypted data, namely the IV vector value. Upon observation, it was found that during IO transmission, pjsip erroneously mixed up the order.

```
1.Encrypted Application Data: 77a14839f7dddb42...
2.Encrypted Application Data: 77a14839f7dddb44... // wrong here
3.Encrypted Application Data: 77a14839f7dddb43...
...
```

We have identified the specific code segment and confirmed that locks were not applied during data transmission. However, there is another issue, #1573, which advises us not to use `write_mutex` for locking in order to avoid deadlock problems.
Therefore, I believe it is necessary to implement a separate sending lock to ensure that the order of transmission is consistent with the order of obtaining the encrypted data.
The following is my proposed solution.

```cpp
// pjproject/pjlib/src/pj/ssl_sock_imp_common.c
static pj_status_t flush_circ_buf_output(pj_ssl_sock_t *ssock,
                                         pj_ioqueue_op_key_t *send_key,
                                         pj_size_t orig_len, unsigned flags)
{
	// ...
	pj_lock_acquire(ssock->write_mutex);

	// During this process, encrypted data is being acquired.

	// This is the new lock I have added.
	pj_lock_acquire(ssock->sock_send_mutex);

	/* Ticket #1573: Don't hold mutex while calling PJLIB socket send(). */
	pj_lock_release(ssock->write_mutex);

	/* Send it */
#ifdef SSL_SOCK_IMP_USE_OWN_NETWORK
	status = network_send(ssock, &wdata->key, wdata->data.content, &len,
                          flags);
#else
	if (ssock->param.sock_type == pj_SOCK_STREAM()) {
		status = pj_activesock_send(ssock->asock, &wdata->key, 
                                    wdata->data.content, &len,
                                    flags);
	} else {
		status = pj_activesock_sendto(ssock->asock, &wdata->key, 
                                      wdata->data.content, &len,
                                      flags,
                                      (pj_sockaddr_t*)&ssock->rem_addr,
                                      ssock->addr_len);
	}
#endif

	// And release here
	pj_lock_release(ssock->sock_send_mutex);

	// ...
}
```

The newly added `sock_send_mutex` needs to be locked before the release of `write_mutex`, ensuring that the order of data transmission remains consistent with the order of data retrieval.

### Steps to reproduce

When using the same TLS connection to send a large number of messages, occasional disconnections of the TLS connection may occur.

### PJSIP version

2.5.5

### Context

Linux CentOS7
openssl version 1.1.1k

### Log, call stack, etc

```shell
no log
```

**Comment by sauwming** [comment]
Would you like to create a PR for this? (or would you like us to?)

**Comment by YUPANZHAO** [comment]
Of course, I'll submit a PR for this issue in the near future :)
